### ISSUE TITLE
DNS resolution problems with Concourse 5.x

### ISSUE THREAD

**Issue by RaphaelVogel** [concourse/concourse#4085]
## Bug Report

We are running Concourse on K8s. When running jobs we get errors that hostnames could not be resolved. This only happens after our upgrade to Concourse 5.x.

In Concourse 5.x the `resolv.conf` file of a garden runtime container contains the IP of the concourse worker pod as the nameserver, which does not work.

In Concourse 4.x the `resolv.conf` file of a garden container uses Kube DNS service IP as nameserver. This works as expected.

## Version Info

* Concourse version: 5.3
* Deployment type (BOSH/Docker/binary): K8s
* Infrastructure/IaaS: OpenStack
* Did this used to work? Yes with 4.x it worked

**Comment by marco-m** [comment]
To my knowledge a lot of people are running Concourse 5.x on k8s, although I am not so I cannot give you an aswer. Did you try asking on Concourse Discord IM or on the forum https://discuss.concourse-ci.org/ before opening this ticket?

**Comment by RaphaelVogel** [comment]
Yes I did ask on Discord yesterday, but no answer. 
I was also wondering why this is not a problem for others. The only thing what's maybe not so common is OpenStack as infrastructure

**Comment by cirocosta** [comment]
Hi @RaphaelVogel ,

Thanks for reporting! Would you mind clarifying few points?

> When running jobs we get errors that hostnames could not be resolved. 

Are you getting resolution errors just for other kubernetes services that can only be resolved through `kube-dns`, or *anything* (i.e., `google.com`)?

---

In https://github.com/concourse/concourse/issues/3103 we put some details into how the scenarios differ (having the DNS proxy enabled vs disabled), and, if I understood correctly, you didn't change any of the default environment variables regarding DNS, right? (e.g., `CONCOURSE_GARDEN_DNS_*`).

Thank you!

**Comment by multimac** [comment]
I'm also seeing this issue when attempting to use the `git` resource to clone a bitbucket repository, though I'm not using k8s. It fails when attempting to resolve `api.media.atlassian.com`, which is where some of our LFS resources are stored.

```
Identity added: /tmp/git-resource-private-key (/tmp/git-resource-private-key)
Cloning into '/tmp/build/get'...
Downloading files/server installation scripts/files/fonts/SourceSansPro-Regular.ttf (150 KB)
Error downloading object: files/server installation scripts/files/fonts/SourceSansPro-Regular.ttf (6fc6e8f): Smudge error: Error downloading files/server installation scripts/files/fonts/SourceSansPro-Regular.ttf (6fc6e8f223cb7a88d7e0d07af0aa7c45084be3c2b330622c06b5e6c6d9f74768): LFS: Get https://api.media.atlassian.com/file/75bf257c-a085-453f-a0ae-2128696380a4/binary: dial tcp: lookup api.media.atlassian.com: no such host

Errors logged to /tmp/build/get/.git/lfs/logs/20190703T000548.389837387.log
Use `git lfs logs last` to view the log.
error: external filter 'git-lfs filter-process' failed
fatal: files/server installation scripts/files/fonts/SourceSansPro-Regular.ttf: smudge filter lfs failed
warning: Clone succeeded, but checkout failed.
You can inspect what was checked out with 'git status'
and retry the checkout with 'git checkout -f HEAD'
```

Hijacking the container and using `nslookup` to perform the same DNS requests also shows the issue.

```
$ fly -t main hijack --job infrastructure/build-ubuntu-image
bash-5.0# cat /etc/resolv.conf
cat /etc/resolv.conf
nameserver 172.17.0.2
bash-5.0# nslookup api.media.atlassian.com
nslookup api.media.atlassian.com
nslookup: can't resolve '(null)': Name does not resolve

nslookup: can't resolve 'api.media.atlassian.com': Name does not resolve
```

However manually writing the external DNS server to `/etc/resolv.conf` seems to fix the issue

```
bash-5.0# echo "nameserver 172.30.4.211" > /etc/resolv.conf
echo "nameserver 172.30.4.211" > /etc/resolv.conf
bash-5.0# cat /etc/resolv.conf
cat /etc/resolv.conf
nameserver 172.30.4.211
bash-5.0# nslookup api.media.atlassian.com
nslookup api.media.atlassian.com
nslookup: can't resolve '(null)': Name does not resolve

Name:      api.media.atlassian.com
Address 1: 168.1.55.153 99.37.01a8.ip4.static.sl-reverse.com
Address 2: 168.1.55.6 6.37.01a8.ip4.static.sl-reverse.com
Address 3: 168.1.55.151 97.37.01a8.ip4.static.sl-reverse.com
Address 4: 168.1.55.140 8c.37.01a8.ip4.static.sl-reverse.com
```

I'm not sure if this has something to do with IPv6 records in the response. Running `tcpdump` on the Concourse worker and DNS server shows that, for the IPv4 query, the IP addresses are returned but for the IPv6 query no addresses are returned.

```
# Packets captured from the Concourse worker
00:41:03.092686 IP 172.17.0.2.33634 > 172.30.4.211.53: 53357+ AAAA? api.media.atlassian.com. (41)
  00:41:05.629256 IP 172.30.4.211.53 > 172.17.0.2.33634: 53357 4/1/0 CNAME atlassian-mediaapi-sfo.d1.teridioncloud.net., CNAME nz-apac-atlassian-mediaapi-sfo.d1.teridioncloud.net., CNAME 62cbb4-softlayer-syd01-atlassian-m.d1.teridioncloud.net., CNAME b254-62cbb4-softlayer-syd01-atlassian-m.d1.teridioncloud.net. (308)
00:41:03.092751 IP 172.17.0.2.49495 > 172.30.4.211.53: 53103+ A? api.media.atlassian.com. (41)
  00:41:04.685591 IP 172.30.4.211.53 > 172.17.0.2.49495: 53103 8/0/0 CNAME atlassian-mediaapi-sfo.d1.teridioncloud.net., CNAME nz-apac-atlassian-mediaapi-sfo.d1.teridioncloud.net., CNAME 62cbb4-softlayer-syd01-atlassian-m.d1.teridioncloud.net., CNAME b254-62cbb4-softlayer-syd01-atlassian-m.d1.teridioncloud.net., A 168.1.55.151, A 168.1.55.140, A 168.1.55.6, A 168.1.55.153 (310)

# Packets captured from the DNS server
00:41:03.093052 IP 172.30.6.154.33634 > 172.30.4.211.53: 53357+ AAAA? api.media.atlassian.com. (41)
  00:41:05.628852 IP 172.30.4.211.53 > 172.30.6.154.33634: 53357 4/1/0 CNAME atlassian-mediaapi-sfo.d1.teridioncloud.net., CNAME nz-apac-atlassian-mediaapi-sfo.d1.teridioncloud.net., CNAME 62cbb4-softlayer-syd01-atlassian-m.d1.teridioncloud.net., CNAME b254-62cbb4-softlayer-syd01-atlassian-m.d1.teridioncloud.net. (308)
00:41:03.093106 IP 172.30.6.154.49495 > 172.30.4.211.53: 53103+ A? api.media.atlassian.com. (41)
  00:41:04.685163 IP 172.30.4.211.53 > 172.30.6.154.49495: 53103 8/0/0 CNAME atlassian-mediaapi-sfo.d1.teridioncloud.net., CNAME nz-apac-atlassian-mediaapi-sfo.d1.teridioncloud.net., CNAME 62cbb4-softlayer-syd01-atlassian-m.d1.teridioncloud.net., CNAME b254-62cbb4-softlayer-syd01-atlassian-m.d1.teridioncloud.net., A 168.1.55.151, A 168.1.55.140, A 168.1.55.6, A 168.1.55.153 (310)
```

**Comment by RaphaelVogel** [comment]
> Are you getting resolution errors just for other kubernetes services that can only be resolved through kube-dns, or anything (i.e., google.com)?

No resolution of other services works, if not running in garden containers.

> if I understood correctly, you didn't change any of the default environment variables regarding DNS, right? (e.g., CONCOURSE_GARDEN_DNS_*).

Right, I did not set any of the DNS env variables in the helm chart. In https://github.com/concourse/concourse/issues/3103 you describe, that **without** having set CONCOURSE_GARDEN_DNS_PROXY_ENABLED the `resolv.conf` in a garden container should look like this
```
  container
    /etc/resolv.conf
      nameserver <KUBE-DNS>
      search $shaudhs
```
However in my case in the garden container the nameserver points to the pod IP:
```
  container
    /etc/resolv.conf
      nameserver <POD_IP>
```

**Comment by RaphaelVogel** [comment]
I just found: https://github.com/helm/charts/issues/15207

So does this mean, that explicitly setting CONCOURSE_GARDEN_DNS_PROXY_ENABLE to `false`
will have the effect, that in a garden container the nameserver points to KUBE-DNS again (as is Concourse 4.x)?

**Comment by RaphaelVogel** [comment]
I just deployed Concourse using Helm chart setting both environment variables
`CONCOURSE_GARDEN_DNS_PROXY_ENABLE` and `CONCOURSE_WORKER_GARDEN_DNS_PROXY_ENABLE` to `false`.

```
  worker:
    env:
    - name: CONCOURSE_GARDEN_DNS_PROXY_ENABLE
      value: "false"
    - name: CONCOURSE_WORKER_GARDEN_DNS_PROXY_ENABLE
      value: "false"
```

However I still get errors for resource checks like this one:
```
resource script '/opt/resource/check []' failed: exit status 1

stderr:
failed to ping registry: 2 error(s) occurred:

* ping https: Get https://registry-1.docker.io/v2/: dial tcp 34.206.236.31:443: connect: no route to host
* ping http: Get http://registry-1.docker.io/v2/: dial tcp 52.87.94.70:80: connect: no route to host
```

**Comment by YenTheFirst** [comment]
To add a data point - we seem to have been running into this same issue.

One of our pipelines involves running a Task, which runs a Go process, which queries an external API.
On Concourse 4.x, this worked.
On Concourse 5.x, this began failing, with the error:
```
dial tcp: lookup url.example.com on $concourse-worker-pod-ip$:53: read udp 10.254.x.x:$random-port$->$concourse-worker-pod-ip$:53: i/o timeout
```
On Concourse 5.x, after disabling the DNS proxy, the task completes correctly.

This particular error _might_ be related to Go's DNS resolver, and its interaction with the proxy DNS server.

**Comment by bhutkovskyysos** [comment]
Seems like setting `dnsProxyEnable: "false"` in concourse helm chart fixes the issue. I was getting Pod's IP and now it is matching the worker's `/etc/resolv.conf`, which points to kube-dns service.

**Comment by leitu** [comment]
My issue was similar.  my situation is kubernets cluster upgraded to 1.14, the default dns service become coredns. Although I set both ```CONCOURSE_GARDEN_DNS_PROXY_ENABLE``` and ```CONCOURSE_WOKER_GARDEN_DNS_PROXY_ENABLE``` to ``` false```,  even the running container are loading the resolv.conf correctly, but it's still not able to resolve the name. 
it turns out the in ```/etc/resolv.conf``` are missing ```edns0``` in options if we are running with ipv4 based network.
 My fix way is running below command to add edns0 back to resolv file
```kubectl patch statefulset concourse-v5-worker --type='json' -p='[{"op": "add", "path": "/spec/template/spec/dnsConfig", "value": { "options": [ { "name": "ndots", "value": "5" }, { "name": "edns0" } ]}}]'```.

**Comment by garlic0708** [comment]
I seem to have the same issue. Please check my ticket on concourse/docker-image-resource: https://github.com/concourse/docker-image-resource/issues/282

**Comment by taylorsilva** [comment]
Using the helm chart, you can also set the following if you want to leverage the templating in the chart

```yaml
  concourse:
    worker:
      garden:
        dnsProxyEnable: "false"
```

This sets `CONCOURSE_GARDEN_DNS_PROXY_ENABLE` to `false` which is all that's actually needed to get `/etc/resolv.conf` to be the same as the container's host. The env on my worker looks like this now:

```
$ env | grep DNS_PROXY
CONCOURSE_GARDEN_DNS_PROXY_ENABLE=false
CONCOURSE_WORKER_GARDEN_DNS_PROXY_ENABLE=true
```
and `/etc/resolv.conf` looks like this on a container created by Concourse:
```
/tmp/build/7f688b19# cat /etc/resolv.conf
nameserver 10.56.0.10
search ci-topgun.svc.cluster.local svc.cluster.local cluster.local c.cf-concourse-production.internal google.internal
options ndots:5
```
