### ISSUE TITLE
Workers stall due to dropped connection, client doesn't recover, web node leaks goroutines

### ISSUE THREAD

**Issue by vito** [concourse/concourse#5082]
## Bug Report

In our large-scale algorithm test environment, workers gradually stalled over the course of 2 days:

<img width="415" alt="Screen Shot 2020-01-29 at 10 36 01 AM" src="https://user-images.githubusercontent.com/1880/73371103-35dc4b00-4283-11ea-9170-e3e366408589.png">

In investigating one of the workers, the machine seemed fine, but its logs showed that it simply stopped heartbeating. It must have been stuck somewhere.

`lsof -p <worker pid>` revealed that there wasn't even an active connection to the TSA anymore (port 222).

Through this time, `web` node memory usage and goroutines crept up:

<img width="827" alt="Screen Shot 2020-01-29 at 10 36 39 AM" src="https://user-images.githubusercontent.com/1880/73371200-54dadd00-4283-11ea-8cdf-14e728b7db8c.png">

Upon restarting all of the workers (i.e. `bosh restart worker`), the `web` goroutines dropped dramatically, and the memory usage slightly recovered (note: these graphs are over the past hour):

<img width="849" alt="Screen Shot 2020-01-29 at 10 38 54 AM" src="https://user-images.githubusercontent.com/1880/73371398-a4b9a400-4283-11ea-9cb4-aba054fd460a.png">

## Steps to Reproduce

Not sure yet. May need to just chaos test this.

## Expected Results

I would expect the worker client to notice that the connection is broken and to recover/reconnect.

## Actual Results

The worker client hung forever and stopped heartbeating/registering.

## Additional Context

Goroutine dumps: https://gist.github.com/vito/a53e8b484a3d254a0872ebe7f5d15773

The dumps are large; I would recommend cloning the gist instead:

```
$ git clone https://gist.github.com/vito/a53e8b484a3d254a0872ebe7f5d15773
```

## Version Info

* Concourse version: `master`
* Deployment type (BOSH/Docker/binary): BOSH
* Infrastructure/IaaS: GCP
* Browser (if applicable): n/a
* Did this used to work? probably not

**Comment by clarafu** [comment]
We saw this happen again on our large scale environment, it seems like baggageclaim is failing to list volumes and that is causing the workers to stall again.

<img width="376" alt="Screen Shot 2020-02-03 at 3 15 08 PM" src="https://user-images.githubusercontent.com/19290703/73687421-fdc87400-4697-11ea-9c9d-7bc0563e7084.png">

`{"timestamp":"2020-02-03T20:10:01.805211696Z","level":"error","source":"baggageclaim","message":"baggageclaim.api.volume-server.list-volumes.failed-to-encode","data":{"error":"write tcp 127.0.0.1:7788-\u003e127.0.0.1:49456: write: broken pipe","session":"3.1.3755"}}`

Maybe restarting the workers were not enough because baggageclaim is broken somehow?

**Comment by xtreme-sameer-vohra** [comment]
When we found the workers in the degraded/stalled state, were we able to curl the list volumes endpoint on the worker ? Did it succeed ?

**Comment by xtreme-sameer-vohra** [comment]
Looks like it originated from [this](https://github.com/concourse/baggageclaim/blob/master/api/volume_server.go#L306).
The error seems to indicate that the TSA client connection to the baggageclaim died.

That could be a result of the TSA client [ResponseHeaderTimeout](https://github.com/concourse/concourse/blob/master/tsa/tsacmd/remote_cli.go#L88). 

Next Steps for when this happens again
- Curl the `List Volumes` endpoint on the worker to determine if baggageclaim server is up and healthy.
- Do we see a corresponding entry in the logs on from the TSA with `failed-to-list-volumes`. If so, is it a timeout ?

It doesn't appear that we're using the same [gclient](https://github.com/concourse/concourse/blob/master/atc/worker/gclient/factory.go) in the` atc` with our 5 min default request timeout on the `tsa` side, where we are using the [original garden client](https://github.com/concourse/concourse/blob/master/tsa/tsacmd/remote_cli.go)

**Comment by xtreme-sameer-vohra** [comment]
What we have observed
- there is an connection from worker/00af6708-8b86-40cd-83f9-052c93962e92 to ddfec3ea-cb7f-4c40-9d46-1b5a3f57b930.web.web.concourse-algorithm.bosh for a long runnting ssh connection

On Worker
``` 
worker/00af6708-8b86-40cd-83f9-052c93962e92:~$ sudo netstat -nputw | grep 2222 | grep 10.1.0.96
tcp        0      0 10.1.0.158:49382        10.1.0.96:2222          TIME_WAIT   -
tcp        0      0 10.1.0.158:49380        10.1.0.96:2222          TIME_WAIT   -
tcp   4645952 796800 10.1.0.158:38602        10.1.0.96:2222          ESTABLISHED 4938/concourse
tcp        0      0 10.1.0.158:49366        10.1.0.96:2222          TIME_WAIT   -
tcp        0      0 10.1.0.158:49378        10.1.0.96:2222          TIME_WAIT   -
```
Similarly, we observe the connection on the Web
```
web/ddfec3ea-cb7f-4c40-9d46-1b5a3f57b930:~$ sudo netstat -nputw | grep 2222
tcp        0      0 10.1.0.96:2222          10.1.0.124:45422        ESTABLISHED 11430/concourse
tcp   5686464  64640 10.1.0.96:2222          10.1.0.123:35856        ESTABLISHED 11430/concourse
tcp   5431668 4007552 10.1.0.96:2222          10.1.0.119:57234        ESTABLISHED 11430/concourse
tcp   4347724  64768 10.1.0.96:2222          10.1.0.158:38602        ESTABLISHED 11430/concourse
tcp   1083144  46492 10.1.0.96:2222          10.1.0.235:58288        ESTABLISHED 11430/concourse
tcp   5293116 4176256 10.1.0.96:2222          10.1.0.61:56864         ESTABLISHED 11430/concourse
```

However, we aren't able to successfully perform a curl request using the forwarded address, which hangs indefinitely
```
~/w/a53e8b484a3d254a0872ebe7f5d15773 (master) $ fly -t algorithm workers --details
name                                  containers  platform  tags  team  state    version  age   garden address                                                               baggageclaim url                                                                    active tasks  resource types
b5e0b037-f44a-40fb-a04e-735dc01cb75e  252         linux     none  none  running  2.2      6h3m  ddfec3ea-cb7f-4c40-9d46-1b5a3f57b930.web.web.concourse-algorithm.bosh:41529  http://ddfec3ea-cb7f-4c40-9d46-1b5a3f57b930.web.web.concourse-algorithm.bosh:41957  0             bosh-io-release, bosh-io-stemcell, cf, docker-image, git, github-release, hg, mock, pool, registry-image, s3, semver, time, tracker


the following workers have not checked in recently:

name                                  containers  platform  tags  team  state    version  age  garden address                                                               baggageclaim url                                                                    active tasks  resource types
00af6708-b8df-45fa-a550-19d1f3f5a5df  35          linux     none  none  stalled  2.2      8d   ddfec3ea-cb7f-4c40-9d46-1b5a3f57b930.web.web.concourse-algorithm.bosh:39909  http://ddfec3ea-cb7f-4c40-9d46-1b5a3f57b930.web.web.concourse-algorithm.bosh:41741  0             bosh-io-release, bosh-io-stemcell, cf, docker-image, git, github-release, hg, mock, pool, registry-image, s3, semver, time, tracker


web/ddfec3ea-cb7f-4c40-9d46-1b5a3f57b930:~$ curl -vvv ddfec3ea-cb7f-4c40-9d46-1b5a3f57b930.web.web.concourse-algorithm.bosh:39909/containers
*   Trying 10.1.0.96...
* Connected to ddfec3ea-cb7f-4c40-9d46-1b5a3f57b930.web.web.concourse-algorithm.bosh (10.1.0.96) port 39909 (#0)
> GET /containers HTTP/1.1
> Host: ddfec3ea-cb7f-4c40-9d46-1b5a3f57b930.web.web.concourse-algorithm.bosh:39909
> User-Agent: curl/7.47.0
> Accept: */*
>
````

**Comment by pivotal-jamie-klassen** [comment]
FWIW while experimenting with this on my laptop, I found `$ curl 'http://algorithm.concourse-ci.org/api/v1/cli?arch=amd64&platform=darwin'` to behave very strangely. Every once in a while, the request will completely hang when partway finished, or run exceptionally slowly.

```bash
$ curl 'http://algorithm.concourse-ci.org/api/v1/cli?arch=amd64&platform=darwin' > ~/Downloads/fly
  % Total    % Received % Xferd  Average Speed   Time    Time     Time  Current
                                 Dload  Upload   Total   Spent    Left  Speed
 98 20.9M   98 20.5M    0     0   201k      0  0:01:46  0:01:44  0:00:02     0^C
$ curl 'http://algorithm.concourse-ci.org/api/v1/cli?arch=amd64&platform=darwin' > ~/Downloads/fly
  % Total    % Received % Xferd  Average Speed   Time    Time     Time  Current
                                 Dload  Upload   Total   Spent    Left  Speed
100 20.9M  100 20.9M    0     0  3511k      0  0:00:06  0:00:06 --:--:-- 3813k
$ curl 'http://algorithm.concourse-ci.org/api/v1/cli?arch=amd64&platform=darwin' > ~/Downloads/fly
  % Total    % Received % Xferd  Average Speed   Time    Time     Time  Current
                                 Dload  Upload   Total   Spent    Left  Speed
100 20.9M  100 20.9M    0     0  3835k      0  0:00:05  0:00:05 --:--:-- 3908k
$ curl 'http://algorithm.concourse-ci.org/api/v1/cli?arch=amd64&platform=darwin' > ~/Downloads/fly
  % Total    % Received % Xferd  Average Speed   Time    Time     Time  Current
                                 Dload  Upload   Total   Spent    Left  Speed
 18 20.9M   18 3911k    0     0  70376      0  0:05:11  0:00:56  0:04:15     0^C
$ curl 'http://algorithm.concourse-ci.org/api/v1/cli?arch=amd64&platform=darwin' > ~/Downloads/fly
  % Total    % Received % Xferd  Average Speed   Time    Time     Time  Current
                                 Dload  Upload   Total   Spent    Left  Speed
100 20.9M  100 20.9M    0     0   810k      0  0:00:26  0:00:26 --:--:--  887k
$ curl 'http://algorithm.concourse-ci.org/api/v1/cli?arch=amd64&platform=darwin' > ~/Downloads/fly
  % Total    % Received % Xferd  Average Speed   Time    Time     Time  Current
                                 Dload  Upload   Total   Spent    Left  Speed
100 20.9M  100 20.9M    0     0   893k      0  0:00:23  0:00:23 --:--:--  911k
$ curl 'http://algorithm.concourse-ci.org/api/v1/cli?arch=amd64&platform=darwin' > ~/Downloads/fly
  % Total    % Received % Xferd  Average Speed   Time    Time     Time  Current
                                 Dload  Upload   Total   Spent    Left  Speed
100 20.9M  100 20.9M    0     0   838k      0  0:00:25  0:00:25 --:--:--  789k
$ curl 'http://algorithm.concourse-ci.org/api/v1/cli?arch=amd64&platform=darwin' > ~/Downloads/fly
  % Total    % Received % Xferd  Average Speed   Time    Time     Time  Current
                                 Dload  Upload   Total   Spent    Left  Speed
100 20.9M  100 20.9M    0     0   862k      0  0:00:24  0:00:24 --:--:--  859k
$ curl 'http://algorithm.concourse-ci.org/api/v1/cli?arch=amd64&platform=darwin' > ~/Downloads/fly
  % Total    % Received % Xferd  Average Speed   Time    Time     Time  Current
                                 Dload  Upload   Total   Spent    Left  Speed
100 20.9M  100 20.9M    0     0   745k      0  0:00:28  0:00:28 --:--:--  882k
$ curl 'http://algorithm.concourse-ci.org/api/v1/cli?arch=amd64&platform=darwin' > ~/Downloads/fly
  % Total    % Received % Xferd  Average Speed   Time    Time     Time  Current
                                 Dload  Upload   Total   Spent    Left  Speed
100 20.9M  100 20.9M    0     0   803k      0  0:00:26  0:00:26 --:--:--  820k
$ curl 'http://algorithm.concourse-ci.org/api/v1/cli?arch=amd64&platform=darwin' > ~/Downloads/fly
  % Total    % Received % Xferd  Average Speed   Time    Time     Time  Current
                                 Dload  Upload   Total   Spent    Left  Speed
100 20.9M  100 20.9M    0     0   782k      0  0:00:27  0:00:27 --:--:--  812k
$ curl 'http://algorithm.concourse-ci.org/api/v1/cli?arch=amd64&platform=darwin' > ~/Downloads/fly
  % Total    % Received % Xferd  Average Speed   Time    Time     Time  Current
                                 Dload  Upload   Total   Spent    Left  Speed
100 20.9M  100 20.9M    0     0  3629k      0  0:00:05  0:00:05 --:--:-- 3562k
$ curl 'http://algorithm.concourse-ci.org/api/v1/cli?arch=amd64&platform=darwin' > ~/Downloads/fly
  % Total    % Received % Xferd  Average Speed   Time    Time     Time  Current
                                 Dload  Upload   Total   Spent    Left  Speed
  4 20.9M    4  888k    0     0   9841      0  0:37:09  0:01:32  0:35:37     0^C
$ curl 'http://algorithm.concourse-ci.org/api/v1/cli?arch=amd64&platform=darwin' > ~/Downloads/fly
  % Total    % Received % Xferd  Average Speed   Time    Time     Time  Current
                                 Dload  Upload   Total   Spent    Left  Speed
100 20.9M  100 20.9M    0     0   834k      0  0:00:25  0:00:25 --:--:--  861k
$ curl 'http://algorithm.concourse-ci.org/api/v1/cli?arch=amd64&platform=darwin' > ~/Downloads/fly
  % Total    % Received % Xferd  Average Speed   Time    Time     Time  Current
                                 Dload  Upload   Total   Spent    Left  Speed
100 20.9M  100 20.9M    0     0   849k      0  0:00:25  0:00:25 --:--:--  866k
```

**Comment by xtreme-sameer-vohra** [comment]
Concourse SHA `4408858ecb1cbd3d5721ca03058360c1322938e4` is currently deployed on `concourse-algorithm`

**Comment by xtreme-sameer-vohra** [comment]
Notes:
```
SSH Connection will block on READs if
	NewChannel channel is not serviced ( it has a capacity of 16 )
	Requests channel is not serviced ( it has a capacity of 16 )

	Global Responses are not serviced (it has a capacity of 1 and this is technically hidden away from us as its part of the ssh lib -> mux.go )

	Per Channel
		Requests channel is not serviced ( it has a capacity of 16)


Per Channel
	Received packets don't appear to block as its written to a buffer that can grow infinitely

```

**Comment by xtreme-sameer-vohra** [comment]
Some goroutines stuck in the ssh conn mux loop that need to be investigated

<img width="2532" alt="Screen Shot 2020-02-14 at 6 18 34 PM" src="https://user-images.githubusercontent.com/1062564/74575833-7fe95000-4f56-11ea-9283-d796d5befb6d.png">

**Comment by xtreme-sameer-vohra** [comment]
-----------------------
# web-dd  
Feb 14 stack dump  
Total Goroutines 29000 
-----------------------

### Goroutine  #538370550
- This Go Routine is holding a mutex that many other go routines are probably trying to obtain a lock on sending a packet
- #538370551 is the only one that is blocked and using the same channel
- However, there are ~9500 goroutines that are referencing "golang.org/x/crypto/ssh.(*handshakeTransport).writePacket(0xc0449209a0" which are trying to open channels


### Gorouitnes  #541092498, #519043237, #282549262 
- These are also holding a mutex in - golang.org/x/crypto/ssh.(*handshakeTransport).writePacket()
- For #541092498, there are ~4700 go routines are referencing "golang.org/x/crypto/ssh.(*handshakeTransport).writePacket(0xc0449209a0," which are trying to open channels
- For #519043237, there are ~3500 go routines are referencing "golang.org/x/crypto/ssh.(*handshakeTransport).writePacket(0xc00f634160," which are trying to open channels
- For #282549262, there are ~7300 go routines are referencing "golang.org/x/crypto/ssh.(*handshakeTransport).writePacket(0xc03f822b00," which are trying to open channels

### Goroutine #556839571
- These are also holding a mutext in - golang.org/x/crypto/ssh.(*handshakeTransport).writePacket() 
- For #556839571, there are ~5100 go routines are referencing "golang.org/x/crypto/ssh.(*handshakeTransport).writePacket(0xc0002958c0," which are trying to open channels

**Comment by xtreme-sameer-vohra** [comment]
Does the path for the above go routines, specially in the group with #541092498 result in a lock on the entire ssh connection or just on the channel ? If its on the entire ssh connection, then this would result in everything else also getting blocked.

It appears so, as we observe many go routines waiting for a lock on the handshakeTransport trying to open a channel, which uses the sshConn mux to send a message

**Comment by cirocosta** [comment]
assuming this could be something mitigated by keepalive probes at the TCP level (which would then close the conns as needed), I was going to suggest making sure that we're getting the socket's keepalive stuff all set up


       tcp_keepalive_intvl (integer; default: 75; since Linux 2.4)
              The number of seconds between TCP keep-alive probes.

       tcp_keepalive_probes (integer; default: 9; since Linux 2.2)
              The maximum number of TCP keep-alive probes to send before
              giving up and killing the connection if no response is
              obtained from the other end.

       tcp_keepalive_time (integer; default: 7200; since Linux 2.2)
              The number of seconds a connection needs to be idle before TCP
              begins sending out keep-alive probes.  Keep-alives are sent
              only when the SO_KEEPALIVE socket option is enabled.  The
              default value is 7200 seconds (2 hours).  An idle connection
              is terminated after approximately an additional 11 minutes (9
              probes an interval of 75 seconds apart) when keep-alive is
              enabled.

              Note that underlying connection tracking mechanisms and
              application timeouts may be much shorter.


(from http://man7.org/linux/man-pages/man7/tcp.7.html with regards to
system-wide config, but that can be done in a per-socket way too)


but, it turns out that since 1.12, Go sets keepalive for TCP conns by default:

https://go-review.googlesource.com/c/go/+/107196/

e.g., having the following


```go
package main

import (
	"net"
)

func main() {
	_, err := net.Dial("tcp", "8.8.8.8:53")
	if err != nil {
		panic(err)
	}
}
```

one can observe the `setsockopt` setting the right values:


```console
$ strace -f -e setsockopt ./main

[pid  4679] setsockopt(3, SOL_SOCKET, SO_BROADCAST, [1], 4) = 0
[pid  4679] setsockopt(3, SOL_TCP, TCP_NODELAY, [1], 4) = 0
[pid  4679] setsockopt(3, SOL_SOCKET, SO_KEEPALIVE, [1], 4) = 0
[pid  4679] setsockopt(3, SOL_TCP, TCP_KEEPINTVL, [15], 4) = 0
[pid  4679] setsockopt(3, SOL_TCP, TCP_KEEPIDLE, [15], 4) = 0
```

buuuut, although that's now a default, it doesn't mean that the underlying library we use (or our own code) overrides that - could be worth checking anyway

**Comment by xtreme-sameer-vohra** [comment]
Interesting distinction between the `working` and `stuck` connections

```
web/ddfec3ea-cb7f-4c40-9d46-1b5a3f57b930:~$ netstat -nto | grep 2222
tcp        0      0 10.1.0.96:2222          10.1.0.124:45422        ESTABLISHED keepalive (1.71/0/0)
tcp   5686464  64640 10.1.0.96:2222          10.1.0.123:35856        ESTABLISHED unkn-4 (70.87/0/0)
tcp   5431668 4007552 10.1.0.96:2222          10.1.0.119:57234        ESTABLISHED unkn-4 (101.59/0/0)
tcp   4347724  64768 10.1.0.96:2222          10.1.0.158:38602        ESTABLISHED unkn-4 (25.81/0/0)
tcp   1083144  46492 10.1.0.96:2222          10.1.0.235:58288        ESTABLISHED unkn-4 (76.99/0/0)
tcp   5293116 4176256 10.1.0.96:2222          10.1.0.61:56864         ESTABLISHED unkn-4 (97.47/0/0)
```

The broken connections have `unkn-4` states

**Comment by xtreme-sameer-vohra** [comment]
We also observed that `ack` messages on the ssh connection between the `web/ddfe` and affected `worker/00f`

```
web/ddfec3ea-cb7f-4c40-9d46-1b5a3f57b930:/tmp# tcpdump -vvni eth0 | grep '10\.1\.0\.158\.38602'
tcpdump: listening on eth0, link-type EN10MB (Ethernet), capture size 262144 bytes
    10.1.0.158.38602 > 10.1.0.96.2222: Flags [.], cksum 0x9218 (correct), seq 1638025910, ack 1295927611, win 0, options [nop,nop,TS val 3158406590 ecr 2989754662], length 0
    10.1.0.96.2222 > 10.1.0.158.38602: Flags [.], cksum 0x1526 (incorrect -> 0x4869), seq 1, ack 1, win 0, options [nop,nop,TS val 2989875483 ecr 3158304631], length 0
    10.1.0.96.2222 > 10.1.0.158.38602: Flags [.], cksum 0x1526 (incorrect -> 0xfebc), seq 0, ack 1, win 0, options [nop,nop,TS val 2989894344 ecr 3158304631], length 0
    10.1.0.158.38602 > 10.1.0.96.2222: Flags [.], cksum 0x7071 (correct), seq 1, ack 1, win 0, options [nop,nop,TS val 3158425453 ecr 2989875483], length 0
    10.1.0.158.38602 > 10.1.0.96.2222: Flags [.], cksum 0xe22a (correct), seq 0, ack 1, win 0, options [nop,nop,TS val 3158527411 ecr 2989875483], length 0
    10.1.0.96.2222 > 10.1.0.158.38602: Flags [.], cksum 0x1526 (incorrect -> 0x9879), seq 1, ack 1, win 0, options [nop,nop,TS val 2989996305 ecr 3158425453], length 0
    10.1.0.96.2222 > 10.1.0.158.38602: Flags [.], cksum 0x1526 (incorrect -> 0x4ecd), seq 0, ack 1, win 0, options [nop,nop,TS val 2990015166 ecr 3158425453], length 0
    10.1.0.158.38602 > 10.1.0.96.2222: Flags [.], cksum 0xc082 (correct), seq 1, ack 1, win 0, options [nop,nop,TS val 3158546274 ecr 2989996305], length 0
    10.1.0.158.38602 > 10.1.0.96.2222: Flags [.], cksum 0x323b (correct), seq 0, ack 1, win 0, options [nop,nop,TS val 3158648233 ecr 2989996305], length 0
    10.1.0.96.2222 > 10.1.0.158.38602: Flags [.], cksum 0x1526 (incorrect -> 0xe88a), seq 1, ack 1, win 0, options [nop,nop,TS val 2990117127 ecr 3158546274], length 0
    10.1.0.96.2222 > 10.1.0.158.38602: Flags [.], cksum 0x1526 (incorrect -> 0x9ede), seq 0, ack 1, win 0, options [nop,nop,TS val 2990135988 ecr 3158546274], length 0
    10.1.0.158.38602 > 10.1.0.96.2222: Flags [.], cksum 0x1094 (correct), seq 1, ack 1, win 0, options [nop,nop,TS val 3158667095 ecr 2990117127], length 0
    10.1.0.158.38602 > 10.1.0.96.2222: Flags [.], cksum 0x824c (correct), seq 0, ack 1, win 0, options [nop,nop,TS val 3158769054 ecr 2990117127], length 0
    10.1.0.96.2222 > 10.1.0.158.38602: Flags [.], cksum 0x1526 (incorrect -> 0x389d), seq 1, ack 1, win 0, options [nop,nop,TS val 2990237948 ecr 3158667095], length 0
    10.1.0.96.2222 > 10.1.0.158.38602: Flags [.], cksum 0x1526 (incorrect -> 0xeef0), seq 0, ack 1, win 0, options [nop,nop,TS val 2990256809 ecr 3158667095], length 0
    10.1.0.158.38602 > 10.1.0.96.2222: Flags [.], cksum 0x60a6 (correct), seq 1, ack 1, win 0, options [nop,nop,TS val 3158787916 ecr 2990237948], length 0
    10.1.0.158.38602 > 10.1.0.96.2222: Flags [.], cksum 0xd25e (correct), seq 0, ack 1, win 0, options [nop,nop,TS val 3158889875 ecr 2990237948], length 0
    10.1.0.96.2222 > 10.1.0.158.38602: Flags [.], cksum 0x1526 (incorrect -> 0x88ae), seq 1, ack 1, win 0, options [nop,nop,TS val 2990358770 ecr 3158787916], length 0
    10.1.0.96.2222 > 10.1.0.158.38602: Flags [.], cksum 0x1526 (incorrect -> 0x3f02), seq 0, ack 1, win 0, options [nop,nop,TS val 2990377631 ecr 3158787916], length 0
    10.1.0.158.38602 > 10.1.0.96.2222: Flags [.], cksum 0xb0b7 (correct), seq 1, ack 1, win 0, options [nop,nop,TS val 3158908737 ecr 2990358770], length 0
    10.1.0.158.38602 > 10.1.0.96.2222: Flags [.], cksum 0x2270 (correct), seq 0, ack 1, win 0, options [nop,nop,TS val 3159010696 ecr 2990358770], length 0
    10.1.0.96.2222 > 10.1.0.158.38602: Flags [.], cksum 0x1526 (incorrect -> 0xd8bf), seq 1, ack 1, win 0, options [nop,nop,TS val 2990479592 ecr 3158908737], length 0
    10.1.0.96.2222 > 10.1.0.158.38602: Flags [.], cksum 0x1526 (incorrect -> 0x8f14), seq 0, ack 1, win 0, options [nop,nop,TS val 2990498452 ecr 3158908737], length 0
    10.1.0.158.38602 > 10.1.0.96.2222: Flags [.], cksum 0x00c9 (correct), seq 1, ack 1, win 0, options [nop,nop,TS val 3159029558 ecr 2990479592], length 0
    10.1.0.158.38602 > 10.1.0.96.2222: Flags [.], cksum 0x7281 (correct), seq 0, ack 1, win 0, options [nop,nop,TS val 3159131517 ecr 2990479592], length 0
    10.1.0.96.2222 > 10.1.0.158.38602: Flags [.], cksum 0x1526 (incorrect -> 0x28d2), seq 1, ack 1, win 0, options [nop,nop,TS val 2990600413 ecr 3159029558], length 0
    10.1.0.96.2222 > 10.1.0.158.38602: Flags [.], cksum 0x1526 (incorrect -> 0xdf21), seq 0, ack 1, win 0, options [nop,nop,TS val 2990619278 ecr 3159029558], length 0
    10.1.0.158.38602 > 10.1.0.96.2222: Flags [.], cksum 0x50d7 (correct), seq 1, ack 1, win 0, options [nop,nop,TS val 3159150383 ecr 2990600413], length 0
    10.1.0.158.38602 > 10.1.0.96.2222: Flags [.], cksum 0xc28e (correct), seq 0, ack 1, win 0, options [nop,nop,TS val 3159252343 ecr 2990600413], length 0
    10.1.0.96.2222 > 10.1.0.158.38602: Flags [.], cksum 0x1526 (incorrect -> 0x78db), seq 1, ack 1, win 0, options [nop,nop,TS val 2990721239 ecr 3159150383], length 0
    10.1.0.96.2222 > 10.1.0.158.38602: Flags [.], cksum 0x1526 (incorrect -> 0x2f33), seq 0, ack 1, win 0, options [nop,nop,TS val 2990740096 ecr 3159150383], length 0
    10.1.0.158.38602 > 10.1.0.96.2222: Flags [.], cksum 0xa0e8 (correct), seq 1, ack 1, win 0, options [nop,nop,TS val 3159271200 ecr 2990721239], length 0
```

What does the `correct` vs `incorrect` cksum refer to ? We see a pattern where messages from `worker` to `web` are `correct` while the reverse are `incorrect`

**Comment by xtreme-sameer-vohra** [comment]
[Similar issue others have faced](https://github.com/golang/go/issues/27752)

Goroutine trace from web/dd
```
goroutine 538370550 [IO wait, 14334 minutes]:
internal/poll.runtime_pollWait(0x7fd7505b43c0, 0x77, 0xffffffffffffffff)
        /usr/local/go/src/runtime/netpoll.go:184 +0x55
internal/poll.(*pollDesc).wait(0xc07e2ea698, 0x77, 0x0, 0x1000, 0xffffffffffffffff)
        /usr/local/go/src/internal/poll/fd_poll_runtime.go:87 +0x45
internal/poll.(*pollDesc).waitWrite(...)
        /usr/local/go/src/internal/poll/fd_poll_runtime.go:96
internal/poll.(*FD).Write(0xc07e2ea680, 0xc044a2c000, 0x24, 0x1000, 0x0, 0x0, 0x0)
        /usr/local/go/src/internal/poll/fd_unix.go:276 +0x2a9
net.(*netFD).Write(0xc07e2ea680, 0xc044a2c000, 0x24, 0x1000, 0x8020, 0x20, 0x0)
        /usr/local/go/src/net/fd_unix.go:220 +0x4f
net.(*conn).Write(0xc05d69f9d8, 0xc044a2c000, 0x24, 0x1000, 0x0, 0x0, 0x0)
        /usr/local/go/src/net/net.go:196 +0x68
bufio.(*Writer).Flush(0xc00baa83c0, 0x9140, 0x3885360)
        /usr/local/go/src/bufio/bufio.go:593 +0x75
golang.org/x/crypto/ssh.(*connectionState).writePacket(0xc032353268, 0xc00baa83c0, 0x38855a0, 0xc0000ac690, 0xc00be30cc0, 0x9, 0x40, 0xf77d6c, 0xc00be30cc0)
        /go/pkg/mod/golang.org/x/crypto@v0.0.0-20191119213627-4f8c1d86b1ba/ssh/transport.go:182 +0xe2
golang.org/x/crypto/ssh.(*transport).writePacket(0xc032353200, 0xc00be30cc0, 0x9, 0x40, 0xc00be30cc0, 0x2adeba0)
        /go/pkg/mod/golang.org/x/crypto@v0.0.0-20191119213627-4f8c1d86b1ba/ssh/transport.go:172 +0x75
golang.org/x/crypto/ssh.(*handshakeTransport).pushPacket(...)
        /go/pkg/mod/golang.org/x/crypto@v0.0.0-20191119213627-4f8c1d86b1ba/ssh/handshake.go:223
golang.org/x/crypto/ssh.(*handshakeTransport).writePacket(0xc0449209a0, 0xc00be30cc0, 0x9, 0x40, 0x0, 0x0)
        /go/pkg/mod/golang.org/x/crypto@v0.0.0-20191119213627-4f8c1d86b1ba/ssh/handshake.go:516 +0x157
golang.org/x/crypto/ssh.(*channel).writePacket(0xc033445c80, 0xc00be30cc0, 0x9, 0x40, 0xc01cf350f8, 0xc00be30cc0)
        /go/pkg/mod/golang.org/x/crypto@v0.0.0-20191119213627-4f8c1d86b1ba/ssh/channel.go:215 +0xe3
golang.org/x/crypto/ssh.(*channel).sendMessage(0xc033445c80, 0x2c8ac00, 0xc01cf350f8, 0xc01cf350f8, 0x0)
        /go/pkg/mod/golang.org/x/crypto@v0.0.0-20191119213627-4f8c1d86b1ba/ssh/channel.go:227 +0xca
golang.org/x/crypto/ssh.(*channel).adjustWindow(0xc033445c80, 0xc000008000, 0x8000, 0x8000)
        /go/pkg/mod/golang.org/x/crypto@v0.0.0-20191119213627-4f8c1d86b1ba/ssh/channel.go:341 +0xae
golang.org/x/crypto/ssh.(*channel).ReadExtended(0xc033445c80, 0xc03fad6000, 0x8000, 0x8000, 0x0, 0x8000, 0x0, 0x0)
        /go/pkg/mod/golang.org/x/crypto@v0.0.0-20191119213627-4f8c1d86b1ba/ssh/channel.go:357 +0xbf
golang.org/x/crypto/ssh.(*channel).Read(0xc033445c80, 0xc03fad6000, 0x8000, 0x8000, 0x8000, 0x0, 0x0)
        /go/pkg/mod/golang.org/x/crypto@v0.0.0-20191119213627-4f8c1d86b1ba/ssh/channel.go:528 +0x5b
io.copyBuffer(0x388c420, 0xc01104d880, 0x7fd76c8c5090, 0xc033445c80, 0xc03fad6000, 0x8000, 0x8000, 0x203021, 0x203021, 0x203021)
        /usr/local/go/src/io/io.go:402 +0x122
io.Copy(...)
        /usr/local/go/src/io/io.go:364
net.genericReadFrom(0x3889700, 0xc08bbace28, 0x7fd76c8c5090, 0xc033445c80, 0x0, 0x0, 0x2e79a00)
        /usr/local/go/src/net/net.go:625 +0x9a
net.(*TCPConn).readFrom(0xc08bbace28, 0x7fd76c8c5090, 0xc033445c80, 0xc089ec15f8, 0xf4a6ca, 0x2bde740)
        /usr/local/go/src/net/tcpsock_posix.go:54 +0xe2
net.(*TCPConn).ReadFrom(0xc08bbace28, 0x7fd76c8c5090, 0xc033445c80, 0x7fd76c848bb0, 0xc08bbace28, 0xf6e601)
        /usr/local/go/src/net/tcpsock.go:103 +0x4d
io.copyBuffer(0x3889700, 0xc08bbace28, 0x7fd76c8c5090, 0xc033445c80, 0x0, 0x0, 0x0, 0xc089ec1748, 0xf45ca5, 0xc02bece060)
        /usr/local/go/src/io/io.go:388 +0x2ed
io.Copy(...)
        /usr/local/go/src/io/io.go:364
github.com/concourse/concourse/tsa/tsacmd.forwardLocalConn.func1(0x7fd76c848ab0, 0xc08bbace28, 0x7fd76c848ad8, 0xc033445c80)
        /src/tsa/tsacmd/server.go:461 +0x1b7
created by github.com/concourse/concourse/tsa/tsacmd.forwardLocalConn
        /src/tsa/tsacmd/server.go:464 +0x548
```

The responses one the original thread are unfortunately not satisfying as they weren't able to develop a reproducible test case to action. The best suggestions were to configure net.Conn SetDeadline.

**Comment by xtreme-sameer-vohra** [comment]
> We also observed that `ack` messages on the ssh connection between the `web/ddfe` and affected `worker/00f`
> 
> ```
> web/ddfec3ea-cb7f-4c40-9d46-1b5a3f57b930:/tmp# tcpdump -vvni eth0 | grep '10\.1\.0\.158\.38602'
> tcpdump: listening on eth0, link-type EN10MB (Ethernet), capture size 262144 bytes
>     10.1.0.158.38602 > 10.1.0.96.2222: Flags [.], cksum 0x9218 (correct), seq 1638025910, ack 1295927611, win 0, options [nop,nop,TS val 3158406590 ecr 2989754662], length 0
>     10.1.0.96.2222 > 10.1.0.158.38602: Flags [.], cksum 0x1526 (incorrect -> 0x4869), seq 1, ack 1, win 0, options [nop,nop,TS val 2989875483 ecr 3158304631], length 0
>     10.1.0.96.2222 > 10.1.0.158.38602: Flags [.], cksum 0x1526 (incorrect -> 0xfebc), seq 0, ack 1, win 0, options [nop,nop,TS val 2989894344 ecr 3158304631], length 0
>     10.1.0.158.38602 > 10.1.0.96.2222: Flags [.], cksum 0x7071 (correct), seq 1, ack 1, win 0, options [nop,nop,TS val 3158425453 ecr 2989875483], length 0
>     10.1.0.158.38602 > 10.1.0.96.2222: Flags [.], cksum 0xe22a (correct), seq 0, ack 1, win 0, options [nop,nop,TS val 3158527411 ecr 2989875483], length 0
>     10.1.0.96.2222 > 10.1.0.158.38602: Flags [.], cksum 0x1526 (incorrect -> 0x9879), seq 1, ack 1, win 0, options [nop,nop,TS val 2989996305 ecr 3158425453], length 0
>     10.1.0.96.2222 > 10.1.0.158.38602: Flags [.], cksum 0x1526 (incorrect -> 0x4ecd), seq 0, ack 1, win 0, options [nop,nop,TS val 2990015166 ecr 3158425453], length 0
>     10.1.0.158.38602 > 10.1.0.96.2222: Flags [.], cksum 0xc082 (correct), seq 1, ack 1, win 0, options [nop,nop,TS val 3158546274 ecr 2989996305], length 0
>     10.1.0.158.38602 > 10.1.0.96.2222: Flags [.], cksum 0x323b (correct), seq 0, ack 1, win 0, options [nop,nop,TS val 3158648233 ecr 2989996305], length 0
>     10.1.0.96.2222 > 10.1.0.158.38602: Flags [.], cksum 0x1526 (incorrect -> 0xe88a), seq 1, ack 1, win 0, options [nop,nop,TS val 2990117127 ecr 3158546274], length 0
>     10.1.0.96.2222 > 10.1.0.158.38602: Flags [.], cksum 0x1526 (incorrect -> 0x9ede), seq 0, ack 1, win 0, options [nop,nop,TS val 2990135988 ecr 3158546274], length 0
>     10.1.0.158.38602 > 10.1.0.96.2222: Flags [.], cksum 0x1094 (correct), seq 1, ack 1, win 0, options [nop,nop,TS val 3158667095 ecr 2990117127], length 0
>     10.1.0.158.38602 > 10.1.0.96.2222: Flags [.], cksum 0x824c (correct), seq 0, ack 1, win 0, options [nop,nop,TS val 3158769054 ecr 2990117127], length 0
>     10.1.0.96.2222 > 10.1.0.158.38602: Flags [.], cksum 0x1526 (incorrect -> 0x389d), seq 1, ack 1, win 0, options [nop,nop,TS val 2990237948 ecr 3158667095], length 0
>     10.1.0.96.2222 > 10.1.0.158.38602: Flags [.], cksum 0x1526 (incorrect -> 0xeef0), seq 0, ack 1, win 0, options [nop,nop,TS val 2990256809 ecr 3158667095], length 0
>     10.1.0.158.38602 > 10.1.0.96.2222: Flags [.], cksum 0x60a6 (correct), seq 1, ack 1, win 0, options [nop,nop,TS val 3158787916 ecr 2990237948], length 0
>     10.1.0.158.38602 > 10.1.0.96.2222: Flags [.], cksum 0xd25e (correct), seq 0, ack 1, win 0, options [nop,nop,TS val 3158889875 ecr 2990237948], length 0
>     10.1.0.96.2222 > 10.1.0.158.38602: Flags [.], cksum 0x1526 (incorrect -> 0x88ae), seq 1, ack 1, win 0, options [nop,nop,TS val 2990358770 ecr 3158787916], length 0
>     10.1.0.96.2222 > 10.1.0.158.38602: Flags [.], cksum 0x1526 (incorrect -> 0x3f02), seq 0, ack 1, win 0, options [nop,nop,TS val 2990377631 ecr 3158787916], length 0
>     10.1.0.158.38602 > 10.1.0.96.2222: Flags [.], cksum 0xb0b7 (correct), seq 1, ack 1, win 0, options [nop,nop,TS val 3158908737 ecr 2990358770], length 0
>     10.1.0.158.38602 > 10.1.0.96.2222: Flags [.], cksum 0x2270 (correct), seq 0, ack 1, win 0, options [nop,nop,TS val 3159010696 ecr 2990358770], length 0
>     10.1.0.96.2222 > 10.1.0.158.38602: Flags [.], cksum 0x1526 (incorrect -> 0xd8bf), seq 1, ack 1, win 0, options [nop,nop,TS val 2990479592 ecr 3158908737], length 0
>     10.1.0.96.2222 > 10.1.0.158.38602: Flags [.], cksum 0x1526 (incorrect -> 0x8f14), seq 0, ack 1, win 0, options [nop,nop,TS val 2990498452 ecr 3158908737], length 0
>     10.1.0.158.38602 > 10.1.0.96.2222: Flags [.], cksum 0x00c9 (correct), seq 1, ack 1, win 0, options [nop,nop,TS val 3159029558 ecr 2990479592], length 0
>     10.1.0.158.38602 > 10.1.0.96.2222: Flags [.], cksum 0x7281 (correct), seq 0, ack 1, win 0, options [nop,nop,TS val 3159131517 ecr 2990479592], length 0
>     10.1.0.96.2222 > 10.1.0.158.38602: Flags [.], cksum 0x1526 (incorrect -> 0x28d2), seq 1, ack 1, win 0, options [nop,nop,TS val 2990600413 ecr 3159029558], length 0
>     10.1.0.96.2222 > 10.1.0.158.38602: Flags [.], cksum 0x1526 (incorrect -> 0xdf21), seq 0, ack 1, win 0, options [nop,nop,TS val 2990619278 ecr 3159029558], length 0
>     10.1.0.158.38602 > 10.1.0.96.2222: Flags [.], cksum 0x50d7 (correct), seq 1, ack 1, win 0, options [nop,nop,TS val 3159150383 ecr 2990600413], length 0
>     10.1.0.158.38602 > 10.1.0.96.2222: Flags [.], cksum 0xc28e (correct), seq 0, ack 1, win 0, options [nop,nop,TS val 3159252343 ecr 2990600413], length 0
>     10.1.0.96.2222 > 10.1.0.158.38602: Flags [.], cksum 0x1526 (incorrect -> 0x78db), seq 1, ack 1, win 0, options [nop,nop,TS val 2990721239 ecr 3159150383], length 0
>     10.1.0.96.2222 > 10.1.0.158.38602: Flags [.], cksum 0x1526 (incorrect -> 0x2f33), seq 0, ack 1, win 0, options [nop,nop,TS val 2990740096 ecr 3159150383], length 0
>     10.1.0.158.38602 > 10.1.0.96.2222: Flags [.], cksum 0xa0e8 (correct), seq 1, ack 1, win 0, options [nop,nop,TS val 3159271200 ecr 2990721239], length 0
> ```
> 
> What does the `correct` vs `incorrect` cksum refer to ? We see a pattern where messages from `worker` to `web` are `correct` while the reverse are `incorrect`

[Ref](https://accedian.com/enterprises/blog/tcp-receive-window-everything-need-know/)

When a client (or server – but it is usually the client) advertises a zero value for its window size, this indicates that the TCP receive buffer is full and it cannot receive any more data. It may have a stuck processor or be busy with some other task, which can cause the TCP receive buffer to fill. Zero Windows can also be caused by a problem within the application, where the TCP buffer is not being retrieved.

**Comment by xtreme-sameer-vohra** [comment]
> ```
> setsockopt
> ```

For the SSH connection initiated by the `worker` -> `web`
Keep Alive seems to be enabled
```
worker_1  | [pid    11] setsockopt(14, SOL_SOCKET, SO_BROADCAST, [1], 4) = 0
worker_1  | [pid    11] setsockopt(14, SOL_TCP, TCP_NODELAY, [1], 4) = 0
worker_1  | [pid    11] setsockopt(14, SOL_SOCKET, SO_KEEPALIVE, [1], 4) = 0
worker_1  | [pid    11] setsockopt(14, SOL_TCP, TCP_KEEPINTVL, [15], 4) = 0
worker_1  | [pid    11] setsockopt(14, SOL_TCP, TCP_KEEPIDLE, [15], 4) = 0
```

**Comment by cirocosta** [comment]
> Zero Windows can also be caused by a problem within the application, where the TCP buffer is not being retrieved.

could that mean that we forgot to close something on our side? e.g., a tcp conn that we never `.Read()` but also never close

**Comment by xtreme-sameer-vohra** [comment]
* use `dlv` on the web node to learn about the goroutines that are holding locks:
    * what forwarded port are they servicing?
    * ideally, what HTTP request are they handling?
* What does 'idle' mean, from the perspective of the kernel (`setsockopt`)?
* What do 'keepalive probes' (in the sense of `setsockopt`) look like from the perspective of `tcpdump`?
* what is the difference between these two notions of 'window'?
    * as it appears in the output from `tcpdump`
    * as it is referred to by `golang.org/x/crypto/ssh.(*channel).adjustWindow`
* could we be failing to read from a tcp connection somewhere in our code? We suspect `no` because it appears as each ssh channel has its own buffer in memory to store packets. Hence, it shouldn't impact the underlying TCP Conn.
* Do we know why our https://github.com/concourse/concourse/blob/master/tsa/timeout_conn.go is not killing the connection? Because it sets the deadline _before_ every read or write, rather than after.
* should [this code](https://github.com/concourse/concourse/blob/master/tsa/client.go#L417-L421) do something to close the connection when an application-level keepalive probe fails? Should the application-level keepalive have a timeout?
* should the heartbeater's garden client have a timeout? #5146 and set a nonzero timeout.

**Comment by xtreme-sameer-vohra** [comment]
- We were able to use `dlv` to determine the relationship between the stuck go routines that held a lock on the ssh connection with the established tcp connections we observed on the OS. 
- Similarly, we were also able to use `dlv` to match the tar processes on the worker with the http connections for handling forwarded requests. We observed that the tar process was stuck because the local forwarded connection buffers were full.

**Comment by xtreme-sameer-vohra** [comment]
> * use `dlv` on the web node to learn about the goroutines that are holding locks:
>   
>   * what forwarded port are they servicing?
>   * ideally, what HTTP request are they handling?
> * What does 'idle' mean, from the perspective of the kernel (`setsockopt`)?
> * What do 'keepalive probes' (in the sense of `setsockopt`) look like from the perspective of `tcpdump`?
> * what is the difference between these two notions of 'window'?
>   
>   * as it appears in the output from `tcpdump`
>   * as it is referred to by `golang.org/x/crypto/ssh.(*channel).adjustWindow`
> * could we be failing to read from a tcp connection somewhere in our code? We suspect `no` because it appears as each ssh channel has its own buffer in memory to store packets. Hence, it shouldn't impact the underlying TCP Conn.
> * Do we know why our https://github.com/concourse/concourse/blob/master/tsa/timeout_conn.go is not killing the connection? Because it sets the deadline _before_ every read or write, rather than after.
> * should [this code](https://github.com/concourse/concourse/blob/master/tsa/client.go#L417-L421) do something to close the connection when an application-level keepalive probe fails? Should the application-level keepalive have a timeout?
> * should the heartbeater's garden client have a timeout? #5146 and set a nonzero timeout.

As per [TCP Keepalive HOWTO](https://www.tldp.org/HOWTO/html_single/TCP-Keepalive-HOWTO/#overview) `tcp_keepalive_time`, the interval between the last data packet sent (simple ACKs are not considered data) and the first keepalive probe; **However, we didn't observe this behaviour as the connections stayed around indefinitely despite not seeing any data messages on the connection** 

Test Scenario - Disable Network
1. `docker network disconnect bridge SOME_CONTAINER_ID`
2. We observe after 9*15 s +15s idle ~ 2.5 mins, the connection between a server and client drops, which we believe is the TCP Keep alive in action

**Comment by xtreme-sameer-vohra** [comment]
Added #5246

**Comment by xtreme-sameer-vohra** [comment]
Summary of the bug we'd like to action
---------------------------------------

If the connection between the worker and TSA is impacted such that it exists as per the OS but is not usable by Concourse ( no data packets are being sent, although ack packets are), Concourse should be able to detect this condition and rectify it such that the worker re-registers.

Unfortunately, we haven't been able to identify clear reproduction steps.

**Comment by xtreme-sameer-vohra** [comment]
2 potential ways we were able to identify that could be used to detect this condition are;
- Update the application keepalive such that [SendRequest](https://github.com/concourse/concourse/blob/master/tsa/client.go#L417-L421) times out as we observed it blocked on acquiring a lock ( as observed in the algorithm env )
- Update [timeout_conn](https://github.com/concourse/concourse/blob/master/tsa/timeout_conn.go) so that it times out the connection if Read/Write isn't successful for a period of time. We made the first step in achieving this on [tsa-timeoutconn branch](https://github.com/concourse/concourse/tree/tsa-timeoutconn)

**Comment by xtreme-sameer-vohra** [comment]
Bumped the stemcell `456.14` -> ``456.98` and the concourse release to the current master `aac7b2f461ed2a3ad6fa8d861d439d3774f9fde8` to validate whether the issue is still observed.

**Comment by jomsie** [comment]
update (in case @cirocosta is interested and has suggestions :D )

on our test environment (deployed yesterday morning), datadog showed a worker stalled out at about 12:44 AM UTC.

we jumped on the stalled worker and looked at it's logs (specifically for the `"worker.beacon-runner.beacon.heartbeated"` message), seeing them happen about every 30 seconds, except after 12:43:30, no more of those messages show up!

we did notice a GIANT influx of `"baggageclaim.api.volume-server.get-volume.get-volume.volume-not-found"` messages surrounding the heartbeated message.

looking at dmesg, at 12:43 AM UTC we got a lot of:
```
...
   3098 [  +0.349426] wbrdg-0afe0118: port 1(wu48a1glbs24-0) entered blocking state
   3099 [  +0.000003] wbrdg-0afe0118: port 1(wu48a1glbs24-0) entered forwarding state
   3100 [  +0.067942] wbrdg-0afe0094: port 1(wu48a1glbs13-0) entered blocking state
   3101 [  +0.000004] wbrdg-0afe0094: port 1(wu48a1glbs13-0) entered forwarding state
   3102 [  +0.054608] wbrdg-0afe00b4: port 1(wu48a1glbs1b-0) entered blocking state
   3103 [  +0.000003] wbrdg-0afe00b4: port 1(wu48a1glbs1b-0) entered forwarding state
...
```

anywho, we grabbed a stackdump and noticed some hanging ssh library calls
<img width="1239" alt="Screen Shot 2020-03-03 at 3 34 14 PM" src="https://user-images.githubusercontent.com/2362482/75817127-7fc5be80-5d64-11ea-8abf-ecc0da607b97.png">

which we are currently investigating!

**Comment by cirocosta** [comment]
thanks for sharing!

I might be very wrong, but I think we shouldn't worry much about those
bridge-related messages (coming from the `wbrdg-*` devices) - AFAIK those bridge
devices are there just to provide the network connectivity to the containers
that garden creates, which is not something that `beacon` would be involved with
:thinking:

```

	VM-1.......................................
	.  
	.  host-net-namespace
	.
	.  beacon
	.  bclaim
	.  gdn
	.
  <--> eth0 <--> bridge 
	.          |
	.          |
	.        host-veth
	.          |
	.          |     container net ns .........
	.          |     .
	.          '-----+--container-veth
	.                .
	.                .

```

**Comment by jomsie** [comment]
thanks for the explanation ciro :D

small update as i poke around, 

a second worker is now stalling, happened at about 11:06 AM UTC March 4th.

looks like the last `"worker.beacon-runner.beacon.heartbeated"` happened at 11:05:47 UTC, which lines up pretty well with stallin'.

after the last heartbeated message, there is a similar large-block of volume-not-found messages, just like the first stalled worker, about 100 each of `baggageclaim.api.volume-server.get-volume.get-volume.volume-not-found` and `baggageclaim.api.volume-server.get-volume.volume-not-found` in about 5 seconds.

**Comment by jomsie** [comment]
> Interesting distinction between the `working` and `stuck` connections
> 
> ```
> web/ddfec3ea-cb7f-4c40-9d46-1b5a3f57b930:~$ netstat -nto | grep 2222
> tcp        0      0 10.1.0.96:2222          10.1.0.124:45422        ESTABLISHED keepalive (1.71/0/0)
> tcp   5686464  64640 10.1.0.96:2222          10.1.0.123:35856        ESTABLISHED unkn-4 (70.87/0/0)
> tcp   5431668 4007552 10.1.0.96:2222          10.1.0.119:57234        ESTABLISHED unkn-4 (101.59/0/0)
> tcp   4347724  64768 10.1.0.96:2222          10.1.0.158:38602        ESTABLISHED unkn-4 (25.81/0/0)
> tcp   1083144  46492 10.1.0.96:2222          10.1.0.235:58288        ESTABLISHED unkn-4 (76.99/0/0)
> tcp   5293116 4176256 10.1.0.96:2222          10.1.0.61:56864         ESTABLISHED unkn-4 (97.47/0/0)
> ```
> 
> The broken connections have `unkn-4` states

so just looking at the current 2 stalled workers

```
the following workers have not checked in recently:

name                                  containers  platform  tags  team  state    version  age
1ff3e50f-c141-463b-a054-5bdd5209656d  12          linux     none  none  stalled  2.2      2d
695f7f58-0ddc-44b4-a59b-01781499bc0d  8           linux     none  none  stalled  2.2      2d
```

which correspond to 

```
~ $ bosh -e prod -d concourse-algorithm vms | grep 1ff3e50f
worker/1ff3e50f-09c5-45a1-bc12-40b541693387	running	z1	10.1.0.22 	vm-02094720-6cc4-4374-5cf3-f2b31780b769	worker  	true	-
~ $ bosh -e prod -d concourse-algorithm vms | grep 695f7f58
worker/695f7f58-a31b-4816-b59c-8e08cc9209c7	running	z1	10.1.0.111	vm-68234e6e-1186-4c85-496f-c91c500e27ba	worker  	true	-
```

looks like using netstat on the web vm shows one being unkn-4

```
tcp   5517600 4175104 10.1.0.96:2222          10.1.0.22:56446         ESTABLISHED unkn-4 (73.32/0/0)
```

but the other still looks ok?

```
tcp        0      0 10.1.0.96:2222          10.1.0.111:49944        ESTABLISHED keepalive (0.00/0/0)
```

😕

**Comment by aoldershaw** [comment]
On both of the stalled workers, the following errors appear in the logs:

```
...
{"timestamp":"2020-03-04T12:06:02.794700162Z","level":"error","source":"worker","message":"worker.beacon-runner.beacon.keepalive.failed","data":{"error":"write tcp 10.1.0.111:49944-\u003e10.1.0.96:2222: i/o timeout","session":"4.1.2"}}
{"timestamp":"2020-03-04T12:06:02.796044685Z","level":"error","source":"baggageclaim","message":"baggageclaim.api.volume-server.stream-out.failed-to-stream-out","data":{"error":"signal: broken pipe","session":"3.1.2204803","volume":"72e9437b-3df6-4e3b-79c7-1fa942fb9502"}}
{"timestamp":"2020-03-04T12:06:02.796087940Z","level":"error","source":"baggageclaim","message":"baggageclaim.api.volume-server.stream-out.failed-to-stream-out","data":{"error":"signal: broken pipe","session":"3.1.2204790","volume":"72e9437b-3df6-4e3b-79c7-1fa942fb9502"}}
{"timestamp":"2020-03-04T12:06:02.796338741Z","level":"error","source":"baggageclaim","message":"baggageclaim.api.volume-server.stream-out.failed-to-stream-out","data":{"error":"signal: broken pipe","session":"3.1.2204802","volume":"72e9437b-3df6-4e3b-79c7-1fa942fb9502"}}
{"timestamp":"2020-03-04T12:06:02.797143088Z","level":"error","source":"baggageclaim","message":"baggageclaim.api.volume-server.stream-out.failed-to-stream-out","data":{"error":"signal: broken pipe","session":"3.1.2204874","volume":"72e9437b-3df6-4e3b-79c7-1fa942fb9502"}}
{"timestamp":"2020-03-04T12:06:02.797349052Z","level":"info","source":"guardian","message":"guardian.api.garden-server.run.exited","data":{"handle":"b02fabfd-a3a6-4e12-745f-b793c75646d0","id":"resource","session":"3.1.674749","status":1}}
{"timestamp":"2020-03-04T12:06:02.797592358Z","level":"error","source":"baggageclaim","message":"baggageclaim.api.volume-server.stream-out.failed-to-stream-out","data":{"error":"signal: broken pipe","session":"3.1.2204873","volume":"72e9437b-3df6-4e3b-79c7-1fa942fb9502"}}
{"timestamp":"2020-03-04T12:06:02.804014100Z","level":"info","source":"baggageclaim","message":"baggageclaim.api.volume-server.stream-in.bad-stream-payload","data":{"error":"exit status 2","session":"3.1.2204835","volume":"2aabb168-a47b-4f22-49fa-b6088656dd76"}}
{"timestamp":"2020-03-04T12:06:02.804070893Z","level":"info","source":"baggageclaim","message":"baggageclaim.api.volume-server.stream-in.bad-stream-payload","data":{"error":"exit status 2","session":"3.1.2204864","volume":"277b6f33-eff1-440f-5f00-44ace572f0ef"}}
{"timestamp":"2020-03-04T12:06:02.804191368Z","level":"info","source":"baggageclaim","message":"baggageclaim.api.volume-server.stream-in.bad-stream-payload","data":{"error":"exit status 2","session":"3.1.2204882","volume":"d69509b5-6c25-4ce2-679b-258b30e2a13a"}}
{"timestamp":"2020-03-04T12:06:02.804021977Z","level":"info","source":"baggageclaim","message":"baggageclaim.api.volume-server.stream-in.bad-stream-payload","data":{"error":"exit status 2","session":"3.1.2204829","volume":"378593e1-bbe9-460c-6990-85f08f0c2516"}}
{"timestamp":"2020-03-04T12:06:02.804055298Z","level":"info","source":"baggageclaim","message":"baggageclaim.api.volume-server.stream-in.bad-stream-payload","data":{"error":"exit status 2","session":"3.1.2204756","volume":"34d74432-f219-409b-7728-3e2e35097339"}}
{"timestamp":"2020-03-04T12:06:02.804065376Z","level":"info","source":"baggageclaim","message":"baggageclaim.api.volume-server.stream-in.bad-stream-payload","data":{"error":"exit status 2","session":"3.1.2204739","volume":"913660e5-ea0b-448b-4a03-546f02995f7a"}}
...
```

This is the last attempted keep alive. I would expect the connection to eventually die, since we're no longer sending keepalives:

https://github.com/concourse/concourse/blob/0b5943d9e2a14c6880ae9f0780885cf63d572a88/tsa/client.go#L417-L421

Perhaps we have to also disable keepalives on the TCP connection, as we do here:

https://github.com/concourse/concourse/blob/0b5943d9e2a14c6880ae9f0780885cf63d572a88/tsa/client.go#L427-L435

**Comment by aoldershaw** [comment]
Another worker got into the stalled state, and again, we observe the same failure on keepalive:

```
{"timestamp":"2020-03-06T08:38:39.730227549Z","level":"error","source":"worker","message":"worker.beacon-runner.beacon.keepalive.failed","data":{"error":"write tcp 10.1.0.122:53818-\u003e10.1.0.20:2222: i/o timeout","session":"4.1.4439291"}}
```

I attempted to recreate this locally by forcing the code down the keepalive failure path (modifying the code to early return). While this stops the keepalive messages, the connection seems to remain intact (at least for a while). I'm guessing that the SSH connection in the algorithm environment gets to a bad state to cause the i/o timeout in the first place.

While I couldn't get the local worker to stall by forcing it down the "keepalive failed" path, I tried adding `sshClient.Close()` to this path. This should ensure that beacon terminates on the worker and tries to reconnect to TSA, but as @xtreme-sameer-vohra pointed out, this will likely leak resources on the TSA side (as the initial connection would remain).

**Comment by xtreme-sameer-vohra** [comment]
Yea, it would be beneficial to be able to repro this consistently. Ciro & I hypothesized that might be achieved by lots of baggageclaim streaming & worker<->tsa heartbeating on an ssh connection. 

Nice find with regards to the keep alive timeout. Based on this, adding some logic like you mentioned to handle the error might be our first iteration to solving the issue. 

While, it would leak resources on the TSA, if the ssh connection is degraded that we cannot rely on it, there might not be a way to signal to the TSA to clean up the connection from the worker. We would want to look at keep-alives on the TSA side so it would be able to reliably detect a broken connection.

**Comment by aoldershaw** [comment]
I'm curious to see if it does actually leak resources. According to https://stackoverflow.com/a/23483487, calling `close` would send a `RST` packet to the TSA, and based on your investigation, it seemed that `ACK` packets sent by the worker were received

**Comment by xtreme-sameer-vohra** [comment]
Yea, we observed there were connections in some cases and no connections in some cases. However, as long we know that this could happen, I think it's safe to implement a part of the solution ( close on the worker end ) and observe if the issue on the TSA end is substantial enough to action.

**Comment by xtreme-sameer-vohra** [comment]
Update
------

```
$ fly -t al workers
name                                  containers  platform  tags  team  state    version  age
00af6708-cc9c-42c3-9ce8-1ed1534c365a  67          linux     none  none  running  2.2      4d
1cd47b0a-745a-4469-a631-b8cf7fd0726f  86          linux     none  none  running  2.2      4d
4210cee2-a763-41c7-ae76-bcca9436b098  47          linux     none  none  running  2.2      4d
4807111d-8924-4c2a-af02-a9ef1b0e6b14  34          linux     none  none  running  2.2      4d
501edb90-78c3-4c20-8ef1-d888579514d1  74          linux     none  none  running  2.2      4d
743b25bd-e005-45b4-aad9-8aec21b33dbf  63          linux     none  none  running  2.2      4d
7c279688-403a-4b55-a3ed-dc5d5be472f3  37          linux     none  none  running  2.2      4d
8504814a-866d-4216-84ae-52587d488e8b  40          linux     none  none  running  2.2      4d
86c1b6d9-adb4-4ba4-9814-233914635bdb  43          linux     none  none  running  2.2      4d
9f3ab78e-398b-44ac-8c3a-e8a43dd28f23  23          linux     none  none  running  2.2      4d
a1026981-01cb-49bc-9d8b-ef18d9f03022  61          linux     none  none  running  2.2      4d
b25f6e4d-e0de-4b72-b800-f3efd7c3f819  70          linux     none  none  running  2.2      4d
b94e5a14-4749-42ae-9664-e64e4923fee5  68          linux     none  none  running  2.2      4d
b96b9f3c-aa31-4e94-9071-c7b0b0da8804  51          linux     none  none  running  2.2      4d
bc375505-c0dd-40b0-b334-6f6be85e1ad0  57          linux     none  none  running  2.2      4d
c199752f-0223-42cf-b0aa-3c7bdf9a27ba  36          linux     none  none  running  2.2      4d
d7dc4a52-ad11-44e0-bac3-157e980c82c3  73          linux     none  none  running  2.2      4d
d8095726-ec06-44d6-8c9f-0605a3577413  44          linux     none  none  running  2.2      4d
e4360603-5ea1-476e-8113-fd495abbeade  65          linux     none  none  running  2.2      4d
f149ba16-d3de-4819-bbf2-009152e67adc  91          linux     none  none  running  2.2      4d


the following workers have not checked in recently:

name                                  containers  platform  tags  team  state    version  age
1ff3e50f-c141-463b-a054-5bdd5209656d  12          linux     none  none  stalled  2.2      4d
42324e06-1404-46e2-b907-52efad99daa2  25          linux     none  none  stalled  2.2      4d
466ae9a7-95eb-44dd-acbe-2a6d3aa25c0e  23          linux     none  none  stalled  2.2      4d
591a0953-b5e9-4de3-a978-f5144fefee53  62          linux     none  none  stalled  2.2      4d
681eff36-eb59-4932-ad28-1f2cc8b4a79d  24          linux     none  none  stalled  2.2      4d
695f7f58-0ddc-44b4-a59b-01781499bc0d  8           linux     none  none  stalled  2.2      4d
6ab00e9f-b20d-46c3-9999-416691cb50dc  20          linux     none  none  stalled  2.2      4d
77a923a2-4177-48c6-8013-77ae5fcd06da  19          linux     none  none  stalled  2.2      4d
ada20384-3f68-4fbb-860b-4c7168bd3b98  48          linux     none  none  stalled  2.2      4d
b5e0b037-dfce-4545-98cf-dfaf84496856  33          linux     none  none  stalled  2.2      4d

these stalled workers can be cleaned up by running:

    fly -t al prune-worker -w (name)
```
Looking at their logs

```
bosh -e prod -d concourse-algorithm ssh worker/1ff3e50f-09c5-45a1-bc12-40b541693387 -c 'sudo grep "2222: i/o timeout" /var/vcap/sys/log/worker/*'
worker/1ff3e50f-09c5-45a1-bc12-40b541693387: stdout | /var/vcap/sys/log/worker/worker.stdout.log:{"timestamp":"2020-03-03T01:43:52.384226417Z","level":"error","source":"worker","message":"worker.beacon-runner.beacon.keepalive.failed","data":{"error":"write tcp 10.1.0.22:56446-\u003e10.1.0.96:2222: i/o timeout","session":"4.1.2"}}
```

```
bosh -e prod -d concourse-algorithm ssh worker/42324e06-9279-4911-abf1-768a2a8520ec -c 'sudo grep "2222: i/o timeout" /var/vcap/sys/log/worker/*'
worker/42324e06-9279-4911-abf1-768a2a8520ec: stdout | /var/vcap/sys/log/worker/worker.stdout.log:{"timestamp":"2020-03-06T19:39:30.967925271Z","level":"error","source":"worker","message":"worker.beacon-runner.beacon.keepalive.failed","data":{"error":"write tcp 10.1.0.86:55658-\u003e10.1.0.20:2222: i/o timeout","session":"4.1.3989498"}}
```

// DOESNT HAVE KEEPALIVE TIMEOUT
```
bosh -e prod -d concourse-algorithm ssh worker/466ae9a7-e516-44ab-8ab1-b77a0d670e56 -c 'sudo grep "2222: i/o timeout" /var/vcap/sys/log/worker/*'
```

```
bosh -e prod -d concourse-algorithm ssh worker/591a0953-e59f-4342-970e-6f66e190e195 -c 'sudo grep "2222: i/o timeout" /var/vcap/sys/log/worker/*'
worker/591a0953-e59f-4342-970e-6f66e190e195: stdout | /var/vcap/sys/log/worker/worker.stdout.log:{"timestamp":"2020-03-06T19:05:15.555281213Z","level":"error","source":"worker","message":"worker.beacon-runner.beacon.keepalive.failed","data":{"error":"write tcp 10.1.0.133:40566-\u003e10.1.0.20:2222: i/o timeout","session":"4.1.4394576"}}
```

// DOESNT HAVE KEEPALIVE TIMEOUT
```
bosh -e prod -d concourse-algorithm ssh worker/681eff36-0e39-417f-8e3b-b4df9d73f544 -c 'sudo grep "2222: i/o timeout" /var/vcap/sys/log/worker/*'
```


```
bosh -e prod -d concourse-algorithm ssh worker/695f7f58-a31b-4816-b59c-8e08cc9209c7 -c 'sudo grep "2222: i/o timeout" /var/vcap/sys/log/worker/*'
worker/695f7f58-a31b-4816-b59c-8e08cc9209c7: stdout | /var/vcap/sys/log/worker/worker.stdout.log:{"timestamp":"2020-03-04T12:06:02.794700162Z","level":"error","source":"worker","message":"worker.beacon-runner.beacon.keepalive.failed","data":{"error":"write tcp 10.1.0.111:49944-\u003e10.1.0.96:2222: i/o timeout","session":"4.1.2"}}
```

```
bosh -e prod -d concourse-algorithm ssh worker/6ab00e9f-f511-400e-a833-d9efefd699a5 -c 'sudo grep "2222: i/o timeout" /var/vcap/sys/log/worker/*'
worker/6ab00e9f-f511-400e-a833-d9efefd699a5: stdout | /var/vcap/sys/log/worker/worker.stdout.log:{"timestamp":"2020-03-06T18:59:50.425905275Z","level":"error","source":"worker","message":"worker.beacon-runner.beacon.keepalive.failed","data":{"error":"write tcp 10.1.0.85:38688-\u003e10.1.0.20:2222: i/o timeout","session":"4.1.4665214"}}
```

```
bosh -e prod -d concourse-algorithm ssh worker/77a923a2-1ab4-439c-b797-0bdb8713d3c7 -c 'sudo grep "2222: i/o timeout" /var/vcap/sys/log/worker/*'
worker/77a923a2-1ab4-439c-b797-0bdb8713d3c7: stdout | /var/vcap/sys/log/worker/worker.stdout.log:{"timestamp":"2020-03-06T08:38:39.730227549Z","level":"error","source":"worker","message":"worker.beacon-runner.beacon.keepalive.failed","data":{"error":"write tcp 10.1.0.122:53818-\u003e10.1.0.20:2222: i/o timeout","session":"4.1.4439291"}}
```
// DOESNT HAVE KEEPALIVE TIMEOUT
```
bosh -e prod -d concourse-algorithm ssh worker/ada20384-a69a-486b-9fec-df89b3255887 -c 'sudo grep "2222: i/o timeout" /var/vcap/sys/log/worker/*'
```

```
bosh -e prod -d concourse-algorithm ssh worker/b5e0b037-48f9-4a77-86dc-0a5624db52b1 -c 'sudo grep "2222: i/o timeout" /var/vcap/sys/log/worker/*'
worker/b5e0b037-48f9-4a77-86dc-0a5624db52b1: stdout | /var/vcap/sys/log/worker/worker.stdout.log:{"timestamp":"2020-03-06T19:40:05.839687848Z","level":"error","source":"worker","message":"worker.beacon-runner.beacon.keepalive.failed","data":{"error":"write tcp 10.1.0.124:36280-\u003e10.1.0.20:2222: i/o timeout","session":"4.1.4048217"}}
```

70% of instances had the timeout error. For these, closing the TCP conn in the keepalive section on failure would result in the worker reconnecting

**Comment by xtreme-sameer-vohra** [comment]
Wrote a simple [util](https://gist.github.com/xtreme-sameer-vohra/af89ff91fb91557b4a539c5bea5e0898) that could be used on a web(s) to connect to a worker's baggageclaim server via the SSH connection and see if under extreme load, we are able to reproduce the workers ending up stalled

**Comment by jomsie** [comment]
no real progress today, as we were fixing the certs on the prod bosh director, but we are now at all but 1 worker stalled out!

i'm going to prune and re-create workers on the algorithm deployment, and tomorrow try using that util with `tc` network emulation commands to see if we can reproduce!

**Comment by pivotal-jwinters** [comment]
In light of this issue I wonder if it makes sense to start thinking about having all atc -> worker requests happen over http, and push all the "magic" into the transport. The TSA could become a socks5 proxy. This would let us adopt a more standard approach and make things less error prone.

**Comment by jomsie** [comment]
we got sammy's util working, but nothing really came from it yet.

we did see 1 -> 3 -> all stalled workers, but 26 of 30 recovered and are running again. 4 continue to be stalled.

**Comment by xtreme-sameer-vohra** [comment]
Redeployed Algorithm env with; 
Concourse 5.8.0

Setup [lidar tests](https://github.com/concourse/drills/blob/master/longevity/lidar-test/setup) with `param` being unique per team + pipeline combo

**Comment by xtreme-sameer-vohra** [comment]
> 2 potential ways we were able to identify that could be used to detect this condition are;
> 
> * Update the application keepalive such that [SendRequest](https://github.com/concourse/concourse/blob/master/tsa/client.go#L417-L421) times out as we observed it blocked on acquiring a lock ( as observed in the algorithm env )
> 
> <img alt="Screen Shot 2020-02-27 at 11 54 01 AM" width="1259" src="https://user-images.githubusercontent.com/1062564/75466270-f1160380-5957-11ea-8fb4-86bd514409a7.png">
> 
> * Update [timeout_conn](https://github.com/concourse/concourse/blob/master/tsa/timeout_conn.go) so that it times out the connection if Read/Write isn't successful for a period of time. We made the first step in achieving this on [tsa-timeoutconn branch](https://github.com/concourse/concourse/tree/tsa-timeoutconn)

Added a Draft PR #5323 that
- closes the sshClient conn on SendRequest returning an error
- adds a 5 second timeout around SendRequest being blocked indefinitely

**Comment by xtreme-sameer-vohra** [comment]
> Redeployed Algorithm env with;
> Concourse 5.8.0
> 
> Setup [lidar tests](https://github.com/concourse/drills/blob/master/longevity/lidar-test/setup) with `param` being unique per team + pipeline combo

Still not seeing the same network load as previously as observed on DataDog

**Comment by xtreme-sameer-vohra** [comment]
Deploying `concourse-algorithm-v6-test` with based on master to repro the issue. 

Created the following resources for standing up the new deployment that should be cleaned up after
- DNS entry on GCP
- load balancer on GCP 
- cloud config on prod

**Comment by xtreme-sameer-vohra** [comment]
Update Mar 23
- unfortunately, we haven't been able to reproduce the original problem on v5.8 or v6 again after recreating the environments ( including a new DB ) running the same load as before.
- we will look at polishing up #5323 and creating a PR
- destroy the 2 envs ( algorithm & algorithm-v6-test ) by Wednesday unless we start seeing the old problem again.

**Comment by xtreme-sameer-vohra** [comment]
Observing a variant of this issue on the `algorithm` env which is running `5.8.0`
Behaviour observed
- bosh ssh'ing into the web/0 was slow ( took ~30 s  vs typically taking ~ <5 s ). ssh'ing into web/1 was fine
- all workers were registered to web/0
- running `netstat -to` on web/0 was quite slow ( ~10 s vs typically taking ~ < 2 s ). Observed some recv/send buffers that had non-zero values in the high hundreds of bytes. This is quite low compared to the size of the buffers, however, when things returned to normal ( workers weren't stalled ) the buffers were consistently showing zero values.
- The issue resolved itself and the were returning to `running` states 

# The workers have been consistently stalling for short durations over the last 2 days
![Screen Shot 2020-03-25 at 11 45 23 AM](https://user-images.githubusercontent.com/1062564/77563584-745f4200-6e8f-11ea-883c-8a0451cc08f6.png)

# Observing over a shorter period where the issue is currently happening
![Screen Shot 2020-03-25 at 11 46 14 AM](https://user-images.githubusercontent.com/1062564/77563698-9ce73c00-6e8f-11ea-945d-95aa08594cad.png)
<img width="1436" alt="Screen Shot 2020-03-25 at 11 45 59 AM" src="https://user-images.githubusercontent.com/1062564/77563728-a670a400-6e8f-11ea-8dc2-92c45d52baeb.png">

# Annotated Network graph of web/0 with lines indicating when the workers were stalled
![Screen Shot 2020-03-25 at 11 48 44 AM](https://user-images.githubusercontent.com/1062564/77563801-be482800-6e8f-11ea-9219-e657135dc253.png)

**Comment by xtreme-sameer-vohra** [comment]
filtered worker/0 worker.stdout.log 
- workers were stalled between ~ 15:45 and 15:48
- from the filtered logs on worker/0, there was no successful heartbeat message logged on the server from `15:45:35` to `15:48:22`
- during the impacted period, worker initiated keepalive period ( configured to be a 5s ticker ) had variations of up to 17s

```
93578 {"timestamp":"2020-03-25T15:43:57.615808337Z","level":"debug","source":"worker","message":"worker.beacon-runner.beacon.heartbeated","data":{"session":"4.1"}}
93710 {"timestamp":"2020-03-25T15:44:27.646041620Z","level":"debug","source":"worker","message":"worker.beacon-runner.beacon.heartbeated","data":{"session":"4.1"}}
93733 {"timestamp":"2020-03-25T15:45:05.051681569Z","level":"debug","source":"worker","message":"worker.beacon-runner.beacon.heartbeated","data":{"session":"4.1"}}
94044 {"timestamp":"2020-03-25T15:45:35.257962479Z","level":"debug","source":"worker","message":"worker.beacon-runner.beacon.heartbeated","data":{"session":"4.1"}}

## LARGE GAP OF ~3 mins, where all workers were marked as stalled
#    we expect keepalive ticks every 5 s, however, we can see in the list below there are discrepancies as large as 17s

{"timestamp":"2020-03-25T15:46:38.142332057Z","level":"debug","source":"worker","message":"worker.beacon-runner.beacon.keepalive.tick","data":{"session":"4.1.3"}}
{"timestamp":"2020-03-25T15:46:55.510671196Z","level":"debug","source":"worker","message":"worker.beacon-runner.beacon.keepalive.tick","data":{"session":"4.1.3"}}
{"timestamp":"2020-03-25T15:46:58.142351398Z","level":"debug","source":"worker","message":"worker.beacon-runner.beacon.keepalive.tick","data":{"session":"4.1.3"}}
{"timestamp":"2020-03-25T15:47:03.142412046Z","level":"debug","source":"worker","message":"worker.beacon-runner.beacon.keepalive.tick","data":{"session":"4.1.3"}}
{"timestamp":"2020-03-25T15:47:13.659070692Z","level":"debug","source":"worker","message":"worker.beacon-runner.beacon.keepalive.tick","data":{"session":"4.1.3"}}
{"timestamp":"2020-03-25T15:47:18.142343390Z","level":"debug","source":"worker","message":"worker.beacon-runner.beacon.keepalive.tick","data":{"session":"4.1.3"}}
{"timestamp":"2020-03-25T15:47:23.142333100Z","level":"debug","source":"worker","message":"worker.beacon-runner.beacon.keepalive.tick","data":{"session":"4.1.3"}}
{"timestamp":"2020-03-25T15:47:28.142377342Z","level":"debug","source":"worker","message":"worker.beacon-runner.beacon.keepalive.tick","data":{"session":"4.1.3"}}
{"timestamp":"2020-03-25T15:47:33.142364927Z","level":"debug","source":"worker","message":"worker.beacon-runner.beacon.keepalive.tick","data":{"session":"4.1.3"}}
{"timestamp":"2020-03-25T15:47:38.142386158Z","level":"debug","source":"worker","message":"worker.beacon-runner.beacon.keepalive.tick","data":{"session":"4.1.3"}}
{"timestamp":"2020-03-25T15:47:50.061668081Z","level":"debug","source":"worker","message":"worker.beacon-runner.beacon.keepalive.tick","data":{"session":"4.1.3"}}
{"timestamp":"2020-03-25T15:47:54.368485477Z","level":"debug","source":"worker","message":"worker.beacon-runner.beacon.keepalive.tick","data":{"session":"4.1.3"}}
{"timestamp":"2020-03-25T15:48:00.497467692Z","level":"debug","source":"worker","message":"worker.beacon-runner.beacon.keepalive.tick","data":{"session":"4.1.3"}}
{"timestamp":"2020-03-25T15:48:05.863241685Z","level":"debug","source":"worker","message":"worker.beacon-runner.beacon.keepalive.tick","data":{"session":"4.1.3"}}
{"timestamp":"2020-03-25T15:48:08.142388548Z","level":"debug","source":"worker","message":"worker.beacon-runner.beacon.keepalive.tick","data":{"session":"4.1.3"}}
{"timestamp":"2020-03-25T15:48:13.142438542Z","level":"debug","source":"worker","message":"worker.beacon-runner.beacon.keepalive.tick","data":{"session":"4.1.3"}}
{"timestamp":"2020-03-25T15:48:18.142328179Z","level":"debug","source":"worker","message":"worker.beacon-runner.beacon.keepalive.tick","data":{"session":"4.1.3"}}

##
94088 {"timestamp":"2020-03-25T15:48:22.768744827Z","level":"debug","source":"worker","message":"worker.beacon-runner.beacon.heartbeated","data":{"session":"4.1"}}
```

**Comment by xtreme-sameer-vohra** [comment]
Decommissioning the v6 env

- Builds run in v6 env in ~7 days 
```
atc=> select count(*) from builds;

  count
---------
 7352707
```

- Builds run in v5.8 env in ~9 days 
```
atc=> select count(*) from builds;
  count
---------
 3742744
```

**Comment by xtreme-sameer-vohra** [comment]
Deployed the patch on `5082-worker-stall` onto branch release/5.8.x on the `algorithm` env around 15:45

# Worker running/stall state on Algorithm Environment
![Screen Shot 2020-03-26 at 1 35 31 PM](https://user-images.githubusercontent.com/1062564/77684094-709eee80-6f67-11ea-8d0e-bb3a96b2ec85.png)

Sampled on worker/0, from the logs, there were a few incidences where keepalive had a 5s timeout
```
worker/cd802654-265f-4dd8-a3f9-f5e85009182e:/var/vcap/sys/log/worker# zgrep "failed sending keepalive request" ./*
worker/cd802654-265f-4dd8-a3f9-f5e85009182e:/var/vcap/sys/log/worker# zgrep "timed out sending keepalive request" ./*
./worker.stdout.log.5.gz:{"timestamp":"2020-03-25T20:18:07.431851225Z","level":"error","source":"worker","message":"worker.beacon-runner.beacon.keepalive.timeout","data":{"error":"timed out sending keepalive request","session":"4.1.2"}}
./worker.stdout.log.5.gz:{"timestamp":"2020-03-25T20:18:37.820903117Z","level":"error","source":"worker","message":"worker.beacon-runner.beacon.keepalive.timeout","data":{"error":"timed out sending keepalive request","session":"4.1.7"}}
./worker.stdout.log.5.gz:{"timestamp":"2020-03-25T20:19:19.572281729Z","level":"error","source":"worker","message":"worker.beacon-runner.beacon.keepalive.timeout","data":{"error":"timed out sending keepalive request","session":"4.1.9"}}
```

**Comment by xtreme-sameer-vohra** [comment]
The other outstanding action item would be to switch to the ATC gclient, which is captured in #5146

**Comment by xtreme-sameer-vohra** [comment]
Algorithm's worker state seems stable since deploying the patch in #5323 
Deleting the algorithm env and closing the issue.
